### ISSUE TITLE
Test the circuit with the Kong in the middle

### ISSUE THREAD

**Issue by fernandohackbart** [fernandohackbart/bikeride-lagom#144]
After the configuration should be tested

**Comment by fernandohackbart** [comment]
```
docker build -f /opt/jenkins/workspace/bikeride-build/Docker/authentication-lagom-impl/Dockerfile  -t  bikeride/authentication-lagom-impl:0.0.1-SNAPSHOT /opt/jenkins/workspace/bikeride-build/Docker/authentication-lagom-impl
docker build -f /opt/jenkins/workspace/bikeride-build/Docker/biker-lagom-impl/Dockerfile  -t  bikeride/biker-lagom-impl:0.0.1-SNAPSHOT /opt/jenkins/workspace/bikeride-build/Docker/biker-lagom-impl


docker run -d --name authentication1 --network bikeride-network --ip 172.18.0.41 --dns=172.18.0.100 bikeride/authentication-lagom-impl:0.0.1-SNAPSHOT
docker run -d --name biker1 --network bikeride-network --ip 172.18.0.31 --dns=172.18.0.100 bikeride/biker-lagom-impl:0.0.1-SNAPSHOT

docker run -t --name authentication1 --network bikeride-network --ip 172.18.0.41 --dns=172.18.0.100 -p 9000:9000 bikeride/authentication-lagom-impl:0.0.1-SNAPSHOT
docker run -t --name biker1 --network bikeride-network --ip 172.18.0.31 --dns=172.18.0.100 -p 9001:9000 bikeride/biker-lagom-impl:0.0.1-SNAPSHOT


curl -d {"client":{"clientID":"f0891f51-4fb5-4881-9605-f00e481241d2"},"email":"biker2@bikers.com"} -H "Content-Type: application/json" -X POST http://authentication.api.bikeride.com:8000/api/authn/generatepin
curl -d {"client":{"clientID":"f0891f51-4fb5-4881-9605-f00e481241d2"},"email":"biker2@bikers.com"} -H "Content-Type: application/json" -X POST http://authentication1.container.bikeride.com:9000/api/authn/generatepin


curl http://biker.api.bikeride.com:8000/api/bikers
curl http://biker1.container.bikeride.com:9000/api/bikers

curl -d {"client":{"clientID":"f0891f51-4fb5-4881-9605-f00e481241d2"},"email":"biker2@bikers.com"} -H "Content-Type: application/json" -X POST http://authentication1.container.bikeride.com:9000/api/authn/biker

curl -d '{"client":{"clientID":"3fa69cf5-0783-494c-a929-e1aac72541d9"},"bikerFields":{"name":"Biker1","avatarb64":"picturebiker1","bloodType":"O-","mobile":"+555135900001","email":"biker1@bikers.com","active":true}}'  -H "Content-Type: application/json" -X POST http://authentication.api.bikeride.com:8000/api/authn/biker

curl -d '{"client":{"clientID":"3fa69cf5-0783-494c-a929-e1aac72541d9"},"bikerFields":{"name":"Biker1","avatarb64":"picturebiker1","bloodType":"O-","mobile":"+555135900001","email":"biker1@bikers.com","active":true}}'  -H "Content-Type: application/json" -X POST http://authentication1.container.bikeride.com:9000/api/authn/biker

docker run -t --name biker1 --network bikeride-network --ip 172.18.0.31 --dns=172.18.0.100 bikeride/biker-lagom-impl:0.0.1-SNAPSHOT

/opt/jenkins/workspace/bikeride-build/Docker/biker-lagom-impl/files/biker-lagom-impl/bin/biker-lagom-impl -d -Dlagom.cluster.join-self=on -Dakka.io.dns.async-dns.nameservers=["172.18.0.102"]

docker rmi bikeride/biker-lagom-impl:0.0.1-SNAPSHOT bikeride/authentication-lagom-impl:0.0.1-SNAPSHOT
```

**Comment by fernandohackbart** [comment]
```
21:20:06.677 [debug] com.bikeride.utils.servicelocator.dns.ServiceLocator [sourceThread=application-akka.actor.default-dispatcher-2, akkaTimestamp=21:20:06.677UTC, akkaSource=akka.tcp://application@172.18.0.41:2552/user/DNSServiceLocatorSimple, sourceActorSystem=application] - ###################### resolveSrv - Translated biker to _biker._tcp.biker.api.bikeride.com
21:20:06.680 [debug] com.bikeride.utils.servicelocator.dns.ServiceLocator [sourceThread=application-akka.actor.default-dispatcher-19, akkaTimestamp=21:20:06.680UTC, akkaSource=akka.tcp://application@172.18.0.41:2552/user/DNSServiceLocatorSimple, sourceActorSystem=application] - ###################### resolveSrv - Serrvice translated from _biker._tcp.biker.api.bikeride.com to _biker._http.biker.api.bikeride.com
21:20:06.680 [debug] com.bikeride.utils.servicelocator.dns.ServiceLocator [sourceThread=application-akka.actor.default-dispatcher-3, akkaTimestamp=21:20:06.680UTC, akkaSource=akka.tcp://application@172.18.0.41:2552/user/DNSServiceLocatorSimple, sourceActorSystem=application] - ###################### resolved: Vector(ServiceAddress(http,biker.api.bikeride.com,172.18.0.20,8000))
21:20:06.691 [error] authn [] - Exception in RestCallIdImpl(POST,/api/authn/biker)
com.lightbend.lagom.scaladsl.api.transport.PolicyViolation: {"message":"no API found with those values"}

        at com.lightbend.lagom.scaladsl.api.transport.TransportException$$anonfun$14.apply(Exceptions.scala:241)
        at com.lightbend.lagom.scaladsl.api.transport.TransportException$$anonfun$14.apply(Exceptions.scala:241)
        at com.lightbend.lagom.scaladsl.api.transport.TransportException$$anonfun$fromCodeAndMessage$3.apply(Exceptions.scala:223)
        at com.lightbend.lagom.scaladsl.api.transport.TransportException$$anonfun$fromCodeAndMessage$3.apply(Exceptions.scala:223)
        at scala.Option.fold(Option.scala:158)
        at com.lightbend.lagom.scaladsl.api.transport.TransportException$.fromCodeAndMessage(Exceptions.scala:223)
        at com.lightbend.lagom.scaladsl.api.deser.DefaultExceptionSerializer.fromCodeAndMessage(ExceptionSerializer.scala:114)
        at com.lightbend.lagom.scaladsl.api.deser.DefaultExceptionSerializer.deserialize(ExceptionSerializer.scala:100)
        at com.lightbend.lagom.internal.scaladsl.client.ScaladslServiceApiBridge$class.exceptionSerializerDeserializeHttpException(ScaladslServiceApiBridge.scala:82)
        at com.lightbend.lagom.internal.scaladsl.client.ScaladslClientServiceCallInvoker.exceptionSerializerDeserializeHttpException(ScaladslServiceClientInvoker.scala:110)
        at com.lightbend.lagom.internal.scaladsl.client.ScaladslClientServiceCallInvoker.exceptionSerializerDeserializeHttpException(ScaladslServiceClientInvoker.scala:110)
        at com.lightbend.lagom.internal.client.ClientServiceCallInvoker$$anonfun$com$lightbend$lagom$internal$client$ClientServiceCallInvoker$$makeStrictCall$1.apply(ClientServiceCallInvoker.scala:219)
        at com.lightbend.lagom.internal.client.ClientServiceCallInvoker$$anonfun$com$lightbend$lagom$internal$client$ClientServiceCallInvoker$$makeStrictCall$1.apply(ClientServiceCallInvoker.scala:208)
        at scala.util.Success$$anonfun$map$1.apply(Try.scala:237)
        at scala.util.Try$.apply(Try.scala:192)
        at scala.util.Success.map(Try.scala:237)
        at scala.concurrent.Future$$anonfun$map$1.apply(Future.scala:237)
        at scala.concurrent.Future$$anonfun$map$1.apply(Future.scala:237)
        at scala.concurrent.impl.CallbackRunnable.run(Promise.scala:32)
        at akka.dispatch.BatchingExecutor$AbstractBatch.processBatch(BatchingExecutor.scala:55)
        at akka.dispatch.BatchingExecutor$BlockableBatch$$anonfun$run$1.apply$mcV$sp(BatchingExecutor.scala:91)
        at akka.dispatch.BatchingExecutor$BlockableBatch$$anonfun$run$1.apply(BatchingExecutor.scala:91)
        at akka.dispatch.BatchingExecutor$BlockableBatch$$anonfun$run$1.apply(BatchingExecutor.scala:91)
        at scala.concurrent.BlockContext$.withBlockContext(BlockContext.scala:72)
        at akka.dispatch.BatchingExecutor$BlockableBatch.run(BatchingExecutor.scala:90)
        at akka.dispatch.TaskInvocation.run(AbstractDispatcher.scala:39)
        at akka.dispatch.ForkJoinExecutorConfigurator$AkkaForkJoinTask.exec(AbstractDispatcher.scala:415)
        at scala.concurrent.forkjoin.ForkJoinTask.doExec(ForkJoinTask.java:260)
        at scala.concurrent.forkjoin.ForkJoinPool$WorkQueue.runTask(ForkJoinPool.java:1339)
        at scala.concurrent.forkjoin.ForkJoinPool.runWorker(ForkJoinPool.java:1979)
        at scala.concurrent.forkjoin.ForkJoinWorkerThread.run(ForkJoinWorkerThread.java:107)

```

**Comment by fernandohackbart** [comment]
` tcpdump   -nnXSs 0 -i any tcp port 8000 or tcp port 9000`

**Comment by fernandohackbart** [comment]
```
docker:~ # tcpdump   -nnXSs 0 -i any tcp port 8000 or tcp port 9000
tcpdump: verbose output suppressed, use -v or -vv for full protocol decode
listening on any, link-type LINUX_SLL (Linux cooked), capture size 262144 bytes
20:53:30.642493 IP 172.18.0.1.56198 > 172.18.0.20.8000: Flags [S], seq 3589395852, win 29200, options [mss 1460,sackOK,TS val 2919382854 ecr 0,nop,wscale 7], length 0
        0x0000:  4500 003c 4431 4000 4006 9e51 ac12 0001  E..<D1@.@..Q....
        0x0010:  ac12 0014 db86 1f40 d5f1 d58c 0000 0000  .......@........
        0x0020:  a002 7210 5868 0000 0204 05b4 0402 080a  ..r.Xh..........
        0x0030:  ae02 3f46 0000 0000 0103 0307            ..?F........
20:53:30.642505 IP 172.18.0.1.56198 > 172.18.0.20.8000: Flags [S], seq 3589395852, win 29200, options [mss 1460,sackOK,TS val 2919382854 ecr 0,nop,wscale 7], length 0
        0x0000:  4500 003c 4431 4000 4006 9e51 ac12 0001  E..<D1@.@..Q....
        0x0010:  ac12 0014 db86 1f40 d5f1 d58c 0000 0000  .......@........
        0x0020:  a002 7210 5868 0000 0204 05b4 0402 080a  ..r.Xh..........
        0x0030:  ae02 3f46 0000 0000 0103 0307            ..?F........
20:53:30.642538 IP 172.18.0.20.8000 > 172.18.0.1.56198: Flags [S.], seq 775941279, ack 3589395853, win 28960, options [mss 1460,sackOK,TS val 1451191253 ecr 2919382854,nop,wscale 7], length 0
        0x0000:  4500 003c 0000 4000 4006 e282 ac12 0014  E..<..@.@.......
        0x0010:  ac12 0001 1f40 db86 2e3f ec9f d5f1 d58d  .....@...?......
        0x0020:  a012 7120 5868 0000 0204 05b4 0402 080a  ..q.Xh..........
        0x0030:  567f 6bd5 ae02 3f46 0103 0307            V.k...?F....
20:53:30.642538 IP 172.18.0.20.8000 > 172.18.0.1.56198: Flags [S.], seq 775941279, ack 3589395853, win 28960, options [mss 1460,sackOK,TS val 1451191253 ecr 2919382854,nop,wscale 7], length 0
        0x0000:  4500 003c 0000 4000 4006 e282 ac12 0014  E..<..@.@.......
        0x0010:  ac12 0001 1f40 db86 2e3f ec9f d5f1 d58d  .....@...?......
        0x0020:  a012 7120 5868 0000 0204 05b4 0402 080a  ..q.Xh..........
        0x0030:  567f 6bd5 ae02 3f46 0103 0307            V.k...?F....
20:53:30.642563 IP 172.18.0.1.56198 > 172.18.0.20.8000: Flags [.], ack 775941280, win 229, options [nop,nop,TS val 2919382855 ecr 1451191253], length 0
        0x0000:  4500 0034 4432 4000 4006 9e58 ac12 0001  E..4D2@.@..X....
        0x0010:  ac12 0014 db86 1f40 d5f1 d58d 2e3f eca0  .......@.....?..
        0x0020:  8010 00e5 5860 0000 0101 080a ae02 3f47  ....X`........?G
        0x0030:  567f 6bd5                                V.k.
20:53:30.642565 IP 172.18.0.1.56198 > 172.18.0.20.8000: Flags [.], ack 775941280, win 229, options [nop,nop,TS val 2919382855 ecr 1451191253], length 0
        0x0000:  4500 0034 4432 4000 4006 9e58 ac12 0001  E..4D2@.@..X....
        0x0010:  ac12 0014 db86 1f40 d5f1 d58d 2e3f eca0  .......@.....?..
        0x0020:  8010 00e5 5860 0000 0101 080a ae02 3f47  ....X`........?G
        0x0030:  567f 6bd5                                V.k.
20:53:30.642628 IP 172.18.0.1.56198 > 172.18.0.20.8000: Flags [P.], seq 3589395853:3589396228, ack 775941280, win 229, options [nop,nop,TS val 2919382855 ecr 1451191253], length 375
        0x0000:  4500 01ab 4433 4000 4006 9ce0 ac12 0001  E...D3@.@.......
        0x0010:  ac12 0014 db86 1f40 d5f1 d58d 2e3f eca0  .......@.....?..
        0x0020:  8018 00e5 59d7 0000 0101 080a ae02 3f47  ....Y.........?G
        0x0030:  567f 6bd5 504f 5354 202f 6170 692f 6175  V.k.POST./api/au
        0x0040:  7468 6e2f 6269 6b65 7220 4854 5450 2f31  thn/biker.HTTP/1
        0x0050:  2e31 0d0a 486f 7374 3a20 6175 7468 656e  .1..Host:.authen
        0x0060:  7469 6361 7469 6f6e 2e61 7069 2e62 696b  tication.api.bik
        0x0070:  6572 6964 652e 636f 6d3a 3830 3030 0d0a  eride.com:8000..
        0x0080:  5573 6572 2d41 6765 6e74 3a20 6375 726c  User-Agent:.curl
        0x0090:  2f37 2e35 352e 300d 0a41 6363 6570 743a  /7.55.0..Accept:
        0x00a0:  202a 2f2a 0d0a 436f 6e74 656e 742d 5479  .*/*..Content-Ty
        0x00b0:  7065 3a20 6170 706c 6963 6174 696f 6e2f  pe:.application/
        0x00c0:  6a73 6f6e 0d0a 436f 6e74 656e 742d 4c65  json..Content-Le
        0x00d0:  6e67 7468 3a20 3230 360d 0a0d 0a7b 2263  ngth:.206....{"c
        0x00e0:  6c69 656e 7422 3a7b 2263 6c69 656e 7449  lient":{"clientI
        0x00f0:  4422 3a22 3366 6136 3963 6635 2d30 3738  D":"3fa69cf5-078
        0x0100:  332d 3439 3463 2d61 3932 392d 6531 6161  3-494c-a929-e1aa
        0x0110:  6337 3235 3431 6439 227d 2c22 6269 6b65  c72541d9"},"bike
        0x0120:  7246 6965 6c64 7322 3a7b 226e 616d 6522  rFields":{"name"
        0x0130:  3a22 4269 6b65 7231 222c 2261 7661 7461  :"Biker1","avata
        0x0140:  7262 3634 223a 2270 6963 7475 7265 6269  rb64":"picturebi
        0x0150:  6b65 7231 222c 2262 6c6f 6f64 5479 7065  ker1","bloodType
        0x0160:  223a 224f 2d22 2c22 6d6f 6269 6c65 223a  ":"O-","mobile":
        0x0170:  222b 3535 3531 3335 3930 3030 3031 222c  "+555135900001",
        0x0180:  2265 6d61 696c 223a 2262 696b 6572 3140  "email":"biker1@
        0x0190:  6269 6b65 7273 2e63 6f6d 222c 2261 6374  bikers.com","act
        0x01a0:  6976 6522 3a74 7275 657d 7d              ive":true}}
20:53:33.693531 IP 172.18.0.20.41492 > 172.18.0.41.9000: Flags [P.], seq 244751474:244752052, ack 3714484279, win 237, options [nop,nop,TS val 3052866129 ecr 1256878525], length 578
        0x0000:  4500 0276 1d5a 4000 4006 c2c6 ac12 0014  E..v.Z@.@.......
        0x0010:  ac12 0029 a214 2328 0e96 9c72 dd66 8837  ...)..#(...r.f.7
        0x0020:  8018 00ed 5aca 0000 0101 080a b5f7 0a51  ....Z..........Q
        0x0030:  4aea 71bd 504f 5354 202f 6170 692f 6175  J.q.POST./api/au
        0x0040:  7468 6e2f 6269 6b65 7220 4854 5450 2f31  thn/biker.HTTP/1
        0x0050:  2e31 0d0a 486f 7374 3a20 5f61 7574 6865  .1..Host:._authe
        0x0060:  6e74 6963 6174 696f 6e2e 5f74 6370 2e61  ntication._tcp.a
        0x0070:  7574 6865 6e74 6963 6174 696f 6e2e 636f  uthentication.co
        0x0080:  6e74 6169 6e65 722e 6269 6b65 7269 6465  ntainer.bikeride
        0x0090:  2e63 6f6d 3a39 3030 300d 0a43 6f6e 6e65  .com:9000..Conne
        0x00a0:  6374 696f 6e3a 206b 6565 702d 616c 6976  ction:.keep-aliv
        0x00b0:  650d 0a58 2d46 6f72 7761 7264 6564 2d46  e..X-Forwarded-F
        0x00c0:  6f72 3a20 3137 322e 3138 2e30 2e31 0d0a  or:.172.18.0.1..
        0x00d0:  582d 466f 7277 6172 6465 642d 5072 6f74  X-Forwarded-Prot
        0x00e0:  6f3a 2068 7474 700d 0a58 2d46 6f72 7761  o:.http..X-Forwa
        0x00f0:  7264 6564 2d48 6f73 743a 2061 7574 6865  rded-Host:.authe
        0x0100:  6e74 6963 6174 696f 6e2e 6170 692e 6269  ntication.api.bi
        0x0110:  6b65 7269 6465 2e63 6f6d 0d0a 582d 466f  keride.com..X-Fo
        0x0120:  7277 6172 6465 642d 506f 7274 3a20 3830  rwarded-Port:.80
        0x0130:  3030 0d0a 582d 5265 616c 2d49 503a 2031  00..X-Real-IP:.1
        0x0140:  3732 2e31 382e 302e 310d 0a43 6f6e 7465  72.18.0.1..Conte
        0x0150:  6e74 2d4c 656e 6774 683a 2032 3036 0d0a  nt-Length:.206..
        0x0160:  5573 6572 2d41 6765 6e74 3a20 6375 726c  User-Agent:.curl
        0x0170:  2f37 2e35 352e 300d 0a41 6363 6570 743a  /7.55.0..Accept:
        0x0180:  202a 2f2a 0d0a 436f 6e74 656e 742d 5479  .*/*..Content-Ty
        0x0190:  7065 3a20 6170 706c 6963 6174 696f 6e2f  pe:.application/
        0x01a0:  6a73 6f6e 0d0a 0d0a 7b22 636c 6965 6e74  json....{"client
        0x01b0:  223a 7b22 636c 6965 6e74 4944 223a 2233  ":{"clientID":"3
        0x01c0:  6661 3639 6366 352d 3037 3833 2d34 3934  fa69cf5-0783-494
        0x01d0:  632d 6139 3239 2d65 3161 6163 3732 3534  c-a929-e1aac7254
        0x01e0:  3164 3922 7d2c 2262 696b 6572 4669 656c  1d9"},"bikerFiel
        0x01f0:  6473 223a 7b22 6e61 6d65 223a 2242 696b  ds":{"name":"Bik
        0x0200:  6572 3122 2c22 6176 6174 6172 6236 3422  er1","avatarb64"
        0x0210:  3a22 7069 6374 7572 6562 696b 6572 3122  :"picturebiker1"
        0x0220:  2c22 626c 6f6f 6454 7970 6522 3a22 4f2d  ,"bloodType":"O-
        0x0230:  222c 226d 6f62 696c 6522 3a22 2b35 3535  ","mobile":"+555
        0x0240:  3133 3539 3030 3030 3122 2c22 656d 6169  135900001","emai
        0x0250:  6c22 3a22 6269 6b65 7231 4062 696b 6572  l":"biker1@biker
        0x0260:  732e 636f 6d22 2c22 6163 7469 7665 223a  s.com","active":
        0x0270:  7472 7565 7d7d                           true}}
20:53:33.693549 IP 172.18.0.20.41492 > 172.18.0.41.9000: Flags [P.], seq 244751474:244752052, ack 3714484279, win 237, options [nop,nop,TS val 3052866129 ecr 1256878525], length 578
        0x0000:  4500 0276 1d5a 4000 4006 c2c6 ac12 0014  E..v.Z@.@.......
        0x0010:  ac12 0029 a214 2328 0e96 9c72 dd66 8837  ...)..#(...r.f.7
        0x0020:  8018 00ed 5aca 0000 0101 080a b5f7 0a51  ....Z..........Q
        0x0030:  4aea 71bd 504f 5354 202f 6170 692f 6175  J.q.POST./api/au
        0x0040:  7468 6e2f 6269 6b65 7220 4854 5450 2f31  thn/biker.HTTP/1
        0x0050:  2e31 0d0a 486f 7374 3a20 5f61 7574 6865  .1..Host:._authe
        0x0060:  6e74 6963 6174 696f 6e2e 5f74 6370 2e61  ntication._tcp.a
        0x0070:  7574 6865 6e74 6963 6174 696f 6e2e 636f  uthentication.co
        0x0080:  6e74 6169 6e65 722e 6269 6b65 7269 6465  ntainer.bikeride
        0x0090:  2e63 6f6d 3a39 3030 300d 0a43 6f6e 6e65  .com:9000..Conne
        0x00a0:  6374 696f 6e3a 206b 6565 702d 616c 6976  ction:.keep-aliv
        0x00b0:  650d 0a58 2d46 6f72 7761 7264 6564 2d46  e..X-Forwarded-F
        0x00c0:  6f72 3a20 3137 322e 3138 2e30 2e31 0d0a  or:.172.18.0.1..
        0x00d0:  582d 466f 7277 6172 6465 642d 5072 6f74  X-Forwarded-Prot
        0x00e0:  6f3a 2068 7474 700d 0a58 2d46 6f72 7761  o:.http..X-Forwa
        0x00f0:  7264 6564 2d48 6f73 743a 2061 7574 6865  rded-Host:.authe
        0x0100:  6e74 6963 6174 696f 6e2e 6170 692e 6269  ntication.api.bi
        0x0110:  6b65 7269 6465 2e63 6f6d 0d0a 582d 466f  keride.com..X-Fo
        0x0120:  7277 6172 6465 642d 506f 7274 3a20 3830  rwarded-Port:.80
        0x0130:  3030 0d0a 582d 5265 616c 2d49 503a 2031  00..X-Real-IP:.1
        0x0140:  3732 2e31 382e 302e 310d 0a43 6f6e 7465  72.18.0.1..Conte
        0x0150:  6e74 2d4c 656e 6774 683a 2032 3036 0d0a  nt-Length:.206..
        0x0160:  5573 6572 2d41 6765 6e74 3a20 6375 726c  User-Agent:.curl
        0x0170:  2f37 2e35 352e 300d 0a41 6363 6570 743a  /7.55.0..Accept:
        0x0180:  202a 2f2a 0d0a 436f 6e74 656e 742d 5479  .*/*..Content-Ty
        0x0190:  7065 3a20 6170 706c 6963 6174 696f 6e2f  pe:.application/
        0x01a0:  6a73 6f6e 0d0a 0d0a 7b22 636c 6965 6e74  json....{"client
        0x01b0:  223a 7b22 636c 6965 6e74 4944 223a 2233  ":{"clientID":"3
        0x01c0:  6661 3639 6366 352d 3037 3833 2d34 3934  fa69cf5-0783-494
        0x01d0:  632d 6139 3239 2d65 3161 6163 3732 3534  c-a929-e1aac7254
        0x01e0:  3164 3922 7d2c 2262 696b 6572 4669 656c  1d9"},"bikerFiel
        0x01f0:  6473 223a 7b22 6e61 6d65 223a 2242 696b  ds":{"name":"Bik
        0x0200:  6572 3122 2c22 6176 6174 6172 6236 3422  er1","avatarb64"
        0x0210:  3a22 7069 6374 7572 6562 696b 6572 3122  :"picturebiker1"
        0x0220:  2c22 626c 6f6f 6454 7970 6522 3a22 4f2d  ,"bloodType":"O-
        0x0230:  222c 226d 6f62 696c 6522 3a22 2b35 3535  ","mobile":"+555
        0x0240:  3133 3539 3030 3030 3122 2c22 656d 6169  135900001","emai
        0x0250:  6c22 3a22 6269 6b65 7231 4062 696b 6572  l":"biker1@biker
        0x0260:  732e 636f 6d22 2c22 6163 7469 7665 223a  s.com","active":
        0x0270:  7472 7565 7d7d                           true}}
20:53:33.707468 IP 172.18.0.41.44868 > 172.18.0.20.8000: Flags [P.], seq 2830884104:2830884918, ack 3488290972, win 270, options [nop,nop,TS val 1256892079 ecr 3052852585], length 814
        0x0000:  4500 0362 3555 4000 4006 a9df ac12 0029  E..b5U@.@......)
        0x0010:  ac12 0014 af44 1f40 a8bb dd08 cfeb 189c  .....D.@........
        0x0020:  8018 010e 5bb6 0000 0101 080a 4aea a6af  ....[.......J...
        0x0030:  b5f6 d569 504f 5354 202f 6170 692f 6269  ...iPOST./api/bi
        0x0040:  6b65 7220 4854 5450 2f31 2e31 0d0a 4163  ker.HTTP/1.1..Ac
        0x0050:  6365 7074 3a20 6170 706c 6963 6174 696f  cept:.applicatio
        0x0060:  6e2f 6a73 6f6e 0d0a 5573 6572 2d41 6765  n/json..User-Age
        0x0070:  6e74 3a20 6175 7468 6e0d 0a43 6f6e 7465  nt:.authn..Conte
        0x0080:  6e74 2d54 7970 653a 2061 7070 6c69 6361  nt-Type:.applica
        0x0090:  7469 6f6e 2f6a 736f 6e0d 0a62 696b 6572  tion/json..biker
        0x00a0:  6964 6543 6c69 656e 7449 443a 2062 3730  ideClientID:.b70
        0x00b0:  3361 6632 342d 3061 3434 2d34 3030 362d  3af24-0a44-4006-
        0x00c0:  3831 6266 2d37 6230 3763 6237 3736 3130  81bf-7b07cb77610
        0x00d0:  330d 0a62 696b 6572 6964 6543 6c69 656e  3..bikerideClien
        0x00e0:  7454 6f6b 656e 3a20 6579 4a30 6558 4169  tToken:.eyJ0eXAi
        0x00f0:  4f69 4a4b 5631 5169 4c43 4a68 6247 6369  OiJKV1QiLCJhbGci
        0x0100:  4f69 4a49 557a 5578 4d69 4a39 2e65 794a  OiJIUzUxMiJ9.eyJ
        0x0110:  6c65 4841 694f 6a45 314d 4463 354d 6a45  leHAiOjE1MDc5MjE
        0x0120:  784d 544d 7349 6d6c 6864 4349 364d 5455  xMTMsImlhdCI6MTU
        0x0130:  774e 7a6b 794d 4467 784d 7977 6959 3278  wNzkyMDgxMywiY2x
        0x0140:  705a 5735 3053 5751 694f 694a 694e 7a41  pZW50SWQiOiJiNzA
        0x0150:  7a59 5759 794e 4330 7759 5451 304c 5451  zYWYyNC0wYTQ0LTQ
        0x0160:  774d 4459 744f 4446 695a 6930 3359 6a41  wMDYtODFiZi03YjA
        0x0170:  3359 3249 334e 7a59 784d 444d 694c 434a  3Y2I3NzYxMDMiLCJ
        0x0180:  3163 3256 7953 5751 694f 694a 694e 7a41  1c2VySWQiOiJiNzA
        0x0190:  7a59 5759 794e 4330 7759 5451 304c 5451  zYWYyNC0wYTQ0LTQ
        0x01a0:  774d 4459 744f 4446 695a 6930 3359 6a41  wMDYtODFiZi03YjA
        0x01b0:  3359 3249 334e 7a59 784d 444d 694c 434a  3Y2I3NzYxMDMiLCJ
        0x01c0:  3163 3256 7962 6d46 745a 5349 3649 6b46  1c2VybmFtZSI6IkF
        0x01d0:  3164 4768 6c62 6e52 7059 3246 3061 5739  1dGhlbnRpY2F0aW9
        0x01e0:  7555 3256 7964 6d6c 6a5a 5349 7349 6d6c  uU2VydmljZSIsIml
        0x01f0:  7a55 6d56 6d63 6d56 7a61 4652 7661 3256  zUmVmcmVzaFRva2V
        0x0200:  7549 6a70 6d59 5778 7a5a 5830 2e46 7279  uIjpmYWxzZX0.Fry
        0x0210:  3451 4641 5979 4a65 4b48 6e49 6e5a 4a7a  4QFAYyJeKHnInZJz
        0x0220:  344a 564b 4d5a 2d66 5236 7965 7a59 6c44  4JVKMZ-fR6yezYlD
        0x0230:  564e 4c70 6732 7845 517a 5673 4652 7638  VNLpg2xEQzVsFRv8
        0x0240:  7243 6e4f 7231 7a74 4454 6c46 3947 4732  rCnOr1ztDTlF9GG2
        0x0250:  5535 3653 7650 4152 4348 3379 5642 6541  U56SvPARCH3yVBeA
        0x0260:  456a 510d 0a43 6f6e 7465 6e74 2d4c 656e  EjQ..Content-Len
        0x0270:  6774 683a 2032 3036 0d0a 486f 7374 3a20  gth:.206..Host:.
        0x0280:  3137 322e 3138 2e30 2e32 303a 3830 3030  172.18.0.20:8000
        0x0290:  0d0a 0d0a 7b22 636c 6965 6e74 223a 7b22  ....{"client":{"
        0x02a0:  636c 6965 6e74 4944 223a 2233 6661 3639  clientID":"3fa69
        0x02b0:  6366 352d 3037 3833 2d34 3934 632d 6139  cf5-0783-494c-a9
        0x02c0:  3239 2d65 3161 6163 3732 3534 3164 3922  29-e1aac72541d9"
        0x02d0:  7d2c 2262 696b 6572 4669 656c 6473 223a  },"bikerFields":
        0x02e0:  7b22 6e61 6d65 223a 2242 696b 6572 3122  {"name":"Biker1"
        0x02f0:  2c22 6176 6174 6172 6236 3422 3a22 7069  ,"avatarb64":"pi
        0x0300:  6374 7572 6562 696b 6572 3122 2c22 626c  cturebiker1","bl
        0x0310:  6f6f 6454 7970 6522 3a22 4f2d 222c 226d  oodType":"O-","m
        0x0320:  6f62 696c 6522 3a22 2b35 3535 3133 3539  obile":"+5551359
        0x0330:  3030 3030 3122 2c22 656d 6169 6c22 3a22  00001","email":"
        0x0340:  6269 6b65 7231 4062 696b 6572 732e 636f  biker1@bikers.co
        0x0350:  6d22 2c22 6163 7469 7665 223a 7472 7565  m","active":true
        0x0360:  7d7d                                     }}
20:53:33.707494 IP 172.18.0.41.44868 > 172.18.0.20.8000: Flags [P.], seq 2830884104:2830884918, ack 3488290972, win 270, options [nop,nop,TS val 1256892079 ecr 3052852585], length 814
        0x0000:  4500 0362 3555 4000 4006 a9df ac12 0029  E..b5U@.@......)
        0x0010:  ac12 0014 af44 1f40 a8bb dd08 cfeb 189c  .....D.@........
        0x0020:  8018 010e 5bb6 0000 0101 080a 4aea a6af  ....[.......J...
        0x0030:  b5f6 d569 504f 5354 202f 6170 692f 6269  ...iPOST./api/bi
        0x0040:  6b65 7220 4854 5450 2f31 2e31 0d0a 4163  ker.HTTP/1.1..Ac
        0x0050:  6365 7074 3a20 6170 706c 6963 6174 696f  cept:.applicatio
        0x0060:  6e2f 6a73 6f6e 0d0a 5573 6572 2d41 6765  n/json..User-Age
        0x0070:  6e74 3a20 6175 7468 6e0d 0a43 6f6e 7465  nt:.authn..Conte
        0x0080:  6e74 2d54 7970 653a 2061 7070 6c69 6361  nt-Type:.applica
        0x0090:  7469 6f6e 2f6a 736f 6e0d 0a62 696b 6572  tion/json..biker
        0x00a0:  6964 6543 6c69 656e 7449 443a 2062 3730  ideClientID:.b70
        0x00b0:  3361 6632 342d 3061 3434 2d34 3030 362d  3af24-0a44-4006-
        0x00c0:  3831 6266 2d37 6230 3763 6237 3736 3130  81bf-7b07cb77610
        0x00d0:  330d 0a62 696b 6572 6964 6543 6c69 656e  3..bikerideClien
        0x00e0:  7454 6f6b 656e 3a20 6579 4a30 6558 4169  tToken:.eyJ0eXAi
        0x00f0:  4f69 4a4b 5631 5169 4c43 4a68 6247 6369  OiJKV1QiLCJhbGci
        0x0100:  4f69 4a49 557a 5578 4d69 4a39 2e65 794a  OiJIUzUxMiJ9.eyJ
        0x0110:  6c65 4841 694f 6a45 314d 4463 354d 6a45  leHAiOjE1MDc5MjE
        0x0120:  784d 544d 7349 6d6c 6864 4349 364d 5455  xMTMsImlhdCI6MTU
        0x0130:  774e 7a6b 794d 4467 784d 7977 6959 3278  wNzkyMDgxMywiY2x
        0x0140:  705a 5735 3053 5751 694f 694a 694e 7a41  pZW50SWQiOiJiNzA
        0x0150:  7a59 5759 794e 4330 7759 5451 304c 5451  zYWYyNC0wYTQ0LTQ
        0x0160:  774d 4459 744f 4446 695a 6930 3359 6a41  wMDYtODFiZi03YjA
        0x0170:  3359 3249 334e 7a59 784d 444d 694c 434a  3Y2I3NzYxMDMiLCJ
        0x0180:  3163 3256 7953 5751 694f 694a 694e 7a41  1c2VySWQiOiJiNzA
        0x0190:  7a59 5759 794e 4330 7759 5451 304c 5451  zYWYyNC0wYTQ0LTQ
        0x01a0:  774d 4459 744f 4446 695a 6930 3359 6a41  wMDYtODFiZi03YjA
        0x01b0:  3359 3249 334e 7a59 784d 444d 694c 434a  3Y2I3NzYxMDMiLCJ
        0x01c0:  3163 3256 7962 6d46 745a 5349 3649 6b46  1c2VybmFtZSI6IkF
        0x01d0:  3164 4768 6c62 6e52 7059 3246 3061 5739  1dGhlbnRpY2F0aW9
        0x01e0:  7555 3256 7964 6d6c 6a5a 5349 7349 6d6c  uU2VydmljZSIsIml
        0x01f0:  7a55 6d56 6d63 6d56 7a61 4652 7661 3256  zUmVmcmVzaFRva2V
        0x0200:  7549 6a70 6d59 5778 7a5a 5830 2e46 7279  uIjpmYWxzZX0.Fry
        0x0210:  3451 4641 5979 4a65 4b48 6e49 6e5a 4a7a  4QFAYyJeKHnInZJz
        0x0220:  344a 564b 4d5a 2d66 5236 7965 7a59 6c44  4JVKMZ-fR6yezYlD
        0x0230:  564e 4c70 6732 7845 517a 5673 4652 7638  VNLpg2xEQzVsFRv8
        0x0240:  7243 6e4f 7231 7a74 4454 6c46 3947 4732  rCnOr1ztDTlF9GG2
        0x0250:  5535 3653 7650 4152 4348 3379 5642 6541  U56SvPARCH3yVBeA
        0x0260:  456a 510d 0a43 6f6e 7465 6e74 2d4c 656e  EjQ..Content-Len
        0x0270:  6774 683a 2032 3036 0d0a 486f 7374 3a20  gth:.206..Host:.
        0x0280:  3137 322e 3138 2e30 2e32 303a 3830 3030  172.18.0.20:8000
        0x0290:  0d0a 0d0a 7b22 636c 6965 6e74 223a 7b22  ....{"client":{"
        0x02a0:  636c 6965 6e74 4944 223a 2233 6661 3639  clientID":"3fa69
        0x02b0:  6366 352d 3037 3833 2d34 3934 632d 6139  cf5-0783-494c-a9
        0x02c0:  3239 2d65 3161 6163 3732 3534 3164 3922  29-e1aac72541d9"
        0x02d0:  7d2c 2262 696b 6572 4669 656c 6473 223a  },"bikerFields":
        0x02e0:  7b22 6e61 6d65 223a 2242 696b 6572 3122  {"name":"Biker1"
        0x02f0:  2c22 6176 6174 6172 6236 3422 3a22 7069  ,"avatarb64":"pi
        0x0300:  6374 7572 6562 696b 6572 3122 2c22 626c  cturebiker1","bl
        0x0310:  6f6f 6454 7970 6522 3a22 4f2d 222c 226d  oodType":"O-","m
        0x0320:  6f62 696c 6522 3a22 2b35 3535 3133 3539  obile":"+5551359
        0x0330:  3030 3030 3122 2c22 656d 6169 6c22 3a22  00001","email":"
        0x0340:  6269 6b65 7231 4062 696b 6572 732e 636f  biker1@bikers.co
        0x0350:  6d22 2c22 6163 7469 7665 223a 7472 7565  m","active":true
        0x0360:  7d7d                                     }}
20:53:33.707973 IP 172.18.0.20.8000 > 172.18.0.41.44868: Flags [P.], seq 3488290972:3488291211, ack 2830884918, win 303, options [nop,nop,TS val 3052866143 ecr 1256892079], length 239
        0x0000:  4500 0123 eb9f 4000 4006 f5d3 ac12 0014  E..#..@.@.......
        0x0010:  ac12 0029 1f40 af44 cfeb 189c a8bb e036  ...).@.D.......6
        0x0020:  8018 012f 5977 0000 0101 080a b5f7 0a5f  .../Yw........._
        0x0030:  4aea a6af 4854 5450 2f31 2e31 2034 3034  J...HTTP/1.1.404
        0x0040:  204e 6f74 2046 6f75 6e64 0d0a 4461 7465  .Not.Found..Date
        0x0050:  3a20 4672 692c 2031 3320 4f63 7420 3230  :.Fri,.13.Oct.20
        0x0060:  3137 2031 383a 3533 3a33 3320 474d 540d  17.18:53:33.GMT.
        0x0070:  0a43 6f6e 7465 6e74 2d54 7970 653a 2061  .Content-Type:.a
        0x0080:  7070 6c69 6361 7469 6f6e 2f6a 736f 6e3b  pplication/json;
        0x0090:  2063 6861 7273 6574 3d75 7466 2d38 0d0a  .charset=utf-8..
        0x00a0:  5472 616e 7366 6572 2d45 6e63 6f64 696e  Transfer-Encodin
        0x00b0:  673a 2063 6875 6e6b 6564 0d0a 436f 6e6e  g:.chunked..Conn
        0x00c0:  6563 7469 6f6e 3a20 6b65 6570 2d61 6c69  ection:.keep-ali
        0x00d0:  7665 0d0a 5365 7276 6572 3a20 6b6f 6e67  ve..Server:.kong
        0x00e0:  2f30 2e31 312e 300d 0a0d 0a32 640d 0a7b  /0.11.0....2d..{
        0x00f0:  226d 6573 7361 6765 223a 226e 6f20 4150  "message":"no.AP
        0x0100:  4920 666f 756e 6420 7769 7468 2074 686f  I.found.with.tho
        0x0110:  7365 2076 616c 7565 7322 7d0a 0d0a 300d  se.values"}...0.
        0x0120:  0a0d 0a                                  ...
20:53:33.707983 IP 172.18.0.20.8000 > 172.18.0.41.44868: Flags [P.], seq 3488290972:3488291211, ack 2830884918, win 303, options [nop,nop,TS val 3052866143 ecr 1256892079], length 239
        0x0000:  4500 0123 eb9f 4000 4006 f5d3 ac12 0014  E..#..@.@.......
        0x0010:  ac12 0029 1f40 af44 cfeb 189c a8bb e036  ...).@.D.......6
        0x0020:  8018 012f 5977 0000 0101 080a b5f7 0a5f  .../Yw........._
        0x0030:  4aea a6af 4854 5450 2f31 2e31 2034 3034  J...HTTP/1.1.404
        0x0040:  204e 6f74 2046 6f75 6e64 0d0a 4461 7465  .Not.Found..Date
        0x0050:  3a20 4672 692c 2031 3320 4f63 7420 3230  :.Fri,.13.Oct.20
        0x0060:  3137 2031 383a 3533 3a33 3320 474d 540d  17.18:53:33.GMT.
        0x0070:  0a43 6f6e 7465 6e74 2d54 7970 653a 2061  .Content-Type:.a
        0x0080:  7070 6c69 6361 7469 6f6e 2f6a 736f 6e3b  pplication/json;
        0x0090:  2063 6861 7273 6574 3d75 7466 2d38 0d0a  .charset=utf-8..
        0x00a0:  5472 616e 7366 6572 2d45 6e63 6f64 696e  Transfer-Encodin
        0x00b0:  673a 2063 6875 6e6b 6564 0d0a 436f 6e6e  g:.chunked..Conn
        0x00c0:  6563 7469 6f6e 3a20 6b65 6570 2d61 6c69  ection:.keep-ali
        0x00d0:  7665 0d0a 5365 7276 6572 3a20 6b6f 6e67  ve..Server:.kong
        0x00e0:  2f30 2e31 312e 300d 0a0d 0a32 640d 0a7b  /0.11.0....2d..{
        0x00f0:  226d 6573 7361 6765 223a 226e 6f20 4150  "message":"no.AP
        0x0100:  4920 666f 756e 6420 7769 7468 2074 686f  I.found.with.tho
        0x0110:  7365 2076 616c 7565 7322 7d0a 0d0a 300d  se.values"}...0.
        0x0120:  0a0d 0a                                  ...
20:53:33.708106 IP 172.18.0.41.44868 > 172.18.0.20.8000: Flags [.], ack 3488291211, win 279, options [nop,nop,TS val 1256892080 ecr 3052866143], length 0
        0x0000:  4500 0034 3556 4000 4006 ad0c ac12 0029  E..45V@.@......)
        0x0010:  ac12 0014 af44 1f40 a8bb e036 cfeb 198b  .....D.@...6....
        0x0020:  8010 0117 5888 0000 0101 080a 4aea a6b0  ....X.......J...
        0x0030:  b5f7 0a5f                                ..._
20:53:33.708114 IP 172.18.0.41.44868 > 172.18.0.20.8000: Flags [.], ack 3488291211, win 279, options [nop,nop,TS val 1256892080 ecr 3052866143], length 0
        0x0000:  4500 0034 3556 4000 4006 ad0c ac12 0029  E..45V@.@......)
        0x0010:  ac12 0014 af44 1f40 a8bb e036 cfeb 198b  .....D.@...6....
        0x0020:  8010 0117 5888 0000 0101 080a 4aea a6b0  ....X.......J...
        0x0030:  b5f7 0a5f                                ..._
20:53:33.711727 IP 172.18.0.41.9000 > 172.18.0.20.41492: Flags [P.], seq 3714484279:3714484492, ack 244752052, win 245, options [nop,nop,TS val 1256892084 ecr 3052866129], length 213
        0x0000:  4500 0109 001d 4000 4006 e170 ac12 0029  E.....@.@..p...)
        0x0010:  ac12 0014 2328 a214 dd66 8837 0e96 9eb4  ....#(...f.7....
        0x0020:  8018 00f5 595d 0000 0101 080a 4aea a6b4  ....Y]......J...
        0x0030:  b5f7 0a51 4854 5450 2f31 2e31 2034 3034  ...QHTTP/1.1.404
        0x0040:  204e 6f74 2046 6f75 6e64 0d0a 436f 6e74  .Not.Found..Cont
        0x0050:  656e 742d 4c65 6e67 7468 3a20 3938 0d0a  ent-Length:.98..
        0x0060:  436f 6e74 656e 742d 5479 7065 3a20 6170  Content-Type:.ap
        0x0070:  706c 6963 6174 696f 6e2f 6a73 6f6e 0d0a  plication/json..
        0x0080:  4461 7465 3a20 4672 692c 2031 3320 4f63  Date:.Fri,.13.Oc
        0x0090:  7420 3230 3137 2031 383a 3533 3a33 3320  t.2017.18:53:33.
        0x00a0:  474d 540d 0a0d 0a7b 226e 616d 6522 3a22  GMT....{"name":"
        0x00b0:  556e 6465 7365 7269 616c 697a 6162 6c65  Undeserializable
        0x00c0:  4578 6365 7074 696f 6e22 2c22 6465 7461  Exception","deta
        0x00d0:  696c 223a 227b 5c22 6d65 7373 6167 655c  il":"{\"message\
        0x00e0:  223a 5c22 6e6f 2041 5049 2066 6f75 6e64  ":\"no.API.found
        0x00f0:  2077 6974 6820 7468 6f73 6520 7661 6c75  .with.those.valu
        0x0100:  6573 5c22 7d5c 6e22 7d                   es\"}\n"}
20:53:33.711748 IP 172.18.0.41.9000 > 172.18.0.20.41492: Flags [P.], seq 3714484279:3714484492, ack 244752052, win 245, options [nop,nop,TS val 1256892084 ecr 3052866129], length 213
        0x0000:  4500 0109 001d 4000 4006 e170 ac12 0029  E.....@.@..p...)
        0x0010:  ac12 0014 2328 a214 dd66 8837 0e96 9eb4  ....#(...f.7....
        0x0020:  8018 00f5 595d 0000 0101 080a 4aea a6b4  ....Y]......J...
        0x0030:  b5f7 0a51 4854 5450 2f31 2e31 2034 3034  ...QHTTP/1.1.404
        0x0040:  204e 6f74 2046 6f75 6e64 0d0a 436f 6e74  .Not.Found..Cont
        0x0050:  656e 742d 4c65 6e67 7468 3a20 3938 0d0a  ent-Length:.98..
        0x0060:  436f 6e74 656e 742d 5479 7065 3a20 6170  Content-Type:.ap
        0x0070:  706c 6963 6174 696f 6e2f 6a73 6f6e 0d0a  plication/json..
        0x0080:  4461 7465 3a20 4672 692c 2031 3320 4f63  Date:.Fri,.13.Oc
        0x0090:  7420 3230 3137 2031 383a 3533 3a33 3320  t.2017.18:53:33.
        0x00a0:  474d 540d 0a0d 0a7b 226e 616d 6522 3a22  GMT....{"name":"
        0x00b0:  556e 6465 7365 7269 616c 697a 6162 6c65  Undeserializable
        0x00c0:  4578 6365 7074 696f 6e22 2c22 6465 7461  Exception","deta
        0x00d0:  696c 223a 227b 5c22 6d65 7373 6167 655c  il":"{\"message\
        0x00e0:  223a 5c22 6e6f 2041 5049 2066 6f75 6e64  ":\"no.API.found
        0x00f0:  2077 6974 6820 7468 6f73 6520 7661 6c75  .with.those.valu
        0x0100:  6573 5c22 7d5c 6e22 7d                   es\"}\n"}
20:53:33.711773 IP 172.18.0.20.41492 > 172.18.0.41.9000: Flags [.], ack 3714484492, win 245, options [nop,nop,TS val 3052866147 ecr 1256892084], length 0
        0x0000:  4500 0034 1d5b 4000 4006 c507 ac12 0014  E..4.[@.@.......
        0x0010:  ac12 0029 a214 2328 0e96 9eb4 dd66 890c  ...)..#(.....f..
        0x0020:  8010 00f5 5888 0000 0101 080a b5f7 0a63  ....X..........c
        0x0030:  4aea a6b4                                J...
20:53:33.711778 IP 172.18.0.20.41492 > 172.18.0.41.9000: Flags [.], ack 3714484492, win 245, options [nop,nop,TS val 3052866147 ecr 1256892084], length 0
        0x0000:  4500 0034 1d5b 4000 4006 c507 ac12 0014  E..4.[@.@.......
        0x0010:  ac12 0029 a214 2328 0e96 9eb4 dd66 890c  ...)..#(.....f..
        0x0020:  8010 00f5 5888 0000 0101 080a b5f7 0a63  ....X..........c
        0x0030:  4aea a6b4                                J...
20:53:33.711965 IP 172.18.0.20.8000 > 172.18.0.1.56198: Flags [P.], seq 775941280:775941591, ack 3589396228, win 235, options [nop,nop,TS val 1451194322 ecr 2919382855], length 311
        0x0000:  4500 016b 7d1e 4000 4006 6435 ac12 0014  E..k}.@.@.d5....
        0x0010:  ac12 0001 1f40 db86 2e3f eca0 d5f1 d704  .....@...?......
        0x0020:  8018 00eb 5997 0000 0101 080a 567f 77d2  ....Y.......V.w.
        0x0030:  ae02 3f47 4854 5450 2f31 2e31 2034 3034  ..?GHTTP/1.1.404
        0x0040:  204e 6f74 2046 6f75 6e64 0d0a 436f 6e74  .Not.Found..Cont
        0x0050:  656e 742d 5479 7065 3a20 6170 706c 6963  ent-Type:.applic
        0x0060:  6174 696f 6e2f 6a73 6f6e 0d0a 436f 6e74  ation/json..Cont
        0x0070:  656e 742d 4c65 6e67 7468 3a20 3938 0d0a  ent-Length:.98..
        0x0080:  436f 6e6e 6563 7469 6f6e 3a20 6b65 6570  Connection:.keep
        0x0090:  2d61 6c69 7665 0d0a 4461 7465 3a20 4672  -alive..Date:.Fr
        0x00a0:  692c 2031 3320 4f63 7420 3230 3137 2031  i,.13.Oct.2017.1
        0x00b0:  383a 3533 3a33 3320 474d 540d 0a58 2d4b  8:53:33.GMT..X-K
        0x00c0:  6f6e 672d 5570 7374 7265 616d 2d4c 6174  ong-Upstream-Lat
        0x00d0:  656e 6379 3a20 3330 3639 0d0a 582d 4b6f  ency:.3069..X-Ko
        0x00e0:  6e67 2d50 726f 7879 2d4c 6174 656e 6379  ng-Proxy-Latency
        0x00f0:  3a20 300d 0a56 6961 3a20 6b6f 6e67 2f30  :.0..Via:.kong/0
        0x0100:  2e31 312e 300d 0a0d 0a7b 226e 616d 6522  .11.0....{"name"
        0x0110:  3a22 556e 6465 7365 7269 616c 697a 6162  :"Undeserializab
        0x0120:  6c65 4578 6365 7074 696f 6e22 2c22 6465  leException","de
        0x0130:  7461 696c 223a 227b 5c22 6d65 7373 6167  tail":"{\"messag
        0x0140:  655c 223a 5c22 6e6f 2041 5049 2066 6f75  e\":\"no.API.fou
        0x0150:  6e64 2077 6974 6820 7468 6f73 6520 7661  nd.with.those.va
        0x0160:  6c75 6573 5c22 7d5c 6e22 7d              lues\"}\n"}
20:53:33.711965 IP 172.18.0.20.8000 > 172.18.0.1.56198: Flags [P.], seq 775941280:775941591, ack 3589396228, win 235, options [nop,nop,TS val 1451194322 ecr 2919382855], length 311
        0x0000:  4500 016b 7d1e 4000 4006 6435 ac12 0014  E..k}.@.@.d5....
        0x0010:  ac12 0001 1f40 db86 2e3f eca0 d5f1 d704  .....@...?......
        0x0020:  8018 00eb 5997 0000 0101 080a 567f 77d2  ....Y.......V.w.
        0x0030:  ae02 3f47 4854 5450 2f31 2e31 2034 3034  ..?GHTTP/1.1.404
        0x0040:  204e 6f74 2046 6f75 6e64 0d0a 436f 6e74  .Not.Found..Cont
        0x0050:  656e 742d 5479 7065 3a20 6170 706c 6963  ent-Type:.applic
        0x0060:  6174 696f 6e2f 6a73 6f6e 0d0a 436f 6e74  ation/json..Cont
        0x0070:  656e 742d 4c65 6e67 7468 3a20 3938 0d0a  ent-Length:.98..
        0x0080:  436f 6e6e 6563 7469 6f6e 3a20 6b65 6570  Connection:.keep
        0x0090:  2d61 6c69 7665 0d0a 4461 7465 3a20 4672  -alive..Date:.Fr
        0x00a0:  692c 2031 3320 4f63 7420 3230 3137 2031  i,.13.Oct.2017.1
        0x00b0:  383a 3533 3a33 3320 474d 540d 0a58 2d4b  8:53:33.GMT..X-K
        0x00c0:  6f6e 672d 5570 7374 7265 616d 2d4c 6174  ong-Upstream-Lat
        0x00d0:  656e 6379 3a20 3330 3639 0d0a 582d 4b6f  ency:.3069..X-Ko
        0x00e0:  6e67 2d50 726f 7879 2d4c 6174 656e 6379  ng-Proxy-Latency
        0x00f0:  3a20 300d 0a56 6961 3a20 6b6f 6e67 2f30  :.0..Via:.kong/0
        0x0100:  2e31 312e 300d 0a0d 0a7b 226e 616d 6522  .11.0....{"name"
        0x0110:  3a22 556e 6465 7365 7269 616c 697a 6162  :"Undeserializab
        0x0120:  6c65 4578 6365 7074 696f 6e22 2c22 6465  leException","de
        0x0130:  7461 696c 223a 227b 5c22 6d65 7373 6167  tail":"{\"messag
        0x0140:  655c 223a 5c22 6e6f 2041 5049 2066 6f75  e\":\"no.API.fou
        0x0150:  6e64 2077 6974 6820 7468 6f73 6520 7661  nd.with.those.va
        0x0160:  6c75 6573 5c22 7d5c 6e22 7d              lues\"}\n"}
20:53:33.711991 IP 172.18.0.1.56198 > 172.18.0.20.8000: Flags [.], ack 775941591, win 237, options [nop,nop,TS val 2919385924 ecr 1451194322], length 0
        0x0000:  4500 0034 4434 4000 4006 9e56 ac12 0001  E..4D4@.@..V....
        0x0010:  ac12 0014 db86 1f40 d5f1 d704 2e3f edd7  .......@.....?..
        0x0020:  8010 00ed 5860 0000 0101 080a ae02 4b44  ....X`........KD
        0x0030:  567f 77d2                                V.w.
20:53:33.711993 IP 172.18.0.1.56198 > 172.18.0.20.8000: Flags [.], ack 775941591, win 237, options [nop,nop,TS val 2919385924 ecr 1451194322], length 0
        0x0000:  4500 0034 4434 4000 4006 9e56 ac12 0001  E..4D4@.@..V....
        0x0010:  ac12 0014 db86 1f40 d5f1 d704 2e3f edd7  .......@.....?..
        0x0020:  8010 00ed 5860 0000 0101 080a ae02 4b44  ....X`........KD
        0x0030:  567f 77d2                                V.w.
20:53:33.712110 IP 172.18.0.1.56198 > 172.18.0.20.8000: Flags [F.], seq 3589396228, ack 775941591, win 237, options [nop,nop,TS val 2919385924 ecr 1451194322], length 0
        0x0000:  4500 0034 4435 4000 4006 9e55 ac12 0001  E..4D5@.@..U....
        0x0010:  ac12 0014 db86 1f40 d5f1 d704 2e3f edd7  .......@.....?..
        0x0020:  8011 00ed 5860 0000 0101 080a ae02 4b44  ....X`........KD
        0x0030:  567f 77d2                                V.w.
20:53:33.712114 IP 172.18.0.1.56198 > 172.18.0.20.8000: Flags [F.], seq 3589396228, ack 775941591, win 237, options [nop,nop,TS val 2919385924 ecr 1451194322], length 0
        0x0000:  4500 0034 4435 4000 4006 9e55 ac12 0001  E..4D5@.@..U....
        0x0010:  ac12 0014 db86 1f40 d5f1 d704 2e3f edd7  .......@.....?..
        0x0020:  8011 00ed 5860 0000 0101 080a ae02 4b44  ....X`........KD
        0x0030:  567f 77d2                                V.w.
20:53:33.712182 IP 172.18.0.20.8000 > 172.18.0.1.56198: Flags [F.], seq 775941591, ack 3589396229, win 235, options [nop,nop,TS val 1451194322 ecr 2919385924], length 0
        0x0000:  4500 0034 7d1f 4000 4006 656b ac12 0014  E..4}.@.@.ek....
        0x0010:  ac12 0001 1f40 db86 2e3f edd7 d5f1 d705  .....@...?......
        0x0020:  8011 00eb 5860 0000 0101 080a 567f 77d2  ....X`......V.w.
        0x0030:  ae02 4b44                                ..KD
20:53:33.712182 IP 172.18.0.20.8000 > 172.18.0.1.56198: Flags [F.], seq 775941591, ack 3589396229, win 235, options [nop,nop,TS val 1451194322 ecr 2919385924], length 0
        0x0000:  4500 0034 7d1f 4000 4006 656b ac12 0014  E..4}.@.@.ek....
        0x0010:  ac12 0001 1f40 db86 2e3f edd7 d5f1 d705  .....@...?......
        0x0020:  8011 00eb 5860 0000 0101 080a 567f 77d2  ....X`......V.w.
        0x0030:  ae02 4b44                                ..KD
20:53:33.712205 IP 172.18.0.1.56198 > 172.18.0.20.8000: Flags [.], ack 775941592, win 237, options [nop,nop,TS val 2919385924 ecr 1451194322], length 0
        0x0000:  4500 0034 4436 4000 4006 9e54 ac12 0001  E..4D6@.@..T....
        0x0010:  ac12 0014 db86 1f40 d5f1 d705 2e3f edd8  .......@.....?..
        0x0020:  8010 00ed 5860 0000 0101 080a ae02 4b44  ....X`........KD
        0x0030:  567f 77d2                                V.w.
20:53:33.712208 IP 172.18.0.1.56198 > 172.18.0.20.8000: Flags [.], ack 775941592, win 237, options [nop,nop,TS val 2919385924 ecr 1451194322], length 0
        0x0000:  4500 0034 4436 4000 4006 9e54 ac12 0001  E..4D6@.@..T....
        0x0010:  ac12 0014 db86 1f40 d5f1 d705 2e3f edd8  .......@.....?..
        0x0020:  8010 00ed 5860 0000 0101 080a ae02 4b44  ....X`........KD
        0x0030:  567f 77d2                                V.w.
^C

```

**Comment by fernandohackbart** [comment]
![screenshot-2017-10-14 kong dashboard](https://user-images.githubusercontent.com/26771657/31568287-cced4e26-b073-11e7-8934-b28602dbce4c.png)
![screenshot-2017-10-14 bind dns server webmin 1 840 on 51dcb1e2ec16 ubuntu linux 14 04 5](https://user-images.githubusercontent.com/26771657/31568291-ceea34a0-b073-11e7-8544-0fd4e5a16479.png)
![screenshot-2017-10-14 bind dns server webmin 1 840 on 51dcb1e2ec16 ubuntu linux 14 04 5 2](https://user-images.githubusercontent.com/26771657/31568293-d09a8480-b073-11e7-8b11-4f7b95de4b17.png)

**Comment by fernandohackbart** [comment]
It was my bad, I had some wrong entries in the DNS pointing to the wrong port for biker1.container.bikeride.com

**Comment by fernandohackbart** [comment]
But now I receive HTTP-404 calling the track service

**Comment by fernandohackbart** [comment]
Also Kong does not test the status of each container behind the service, if I point to one container that is down Kong still send requests there and after timeout tries to go to another container.

**Comment by fernandohackbart** [comment]
Dumping just the bikeride network packets:

` tcpdump -nnXSs 0 -i br-21984fcd5f60 tcp port 8000 or tcp port 9000`

**Comment by fernandohackbart** [comment]
OK the uris for track and ride were switched...

![screenshot-2017-10-14 kong dashboard](https://user-images.githubusercontent.com/26771657/31573665-ae099d28-b0c0-11e7-9ac6-7e685d96112b.png)

The biker JMeter test is still failing but now is regarding the Authentication service creating the biker and not the biker thread group... JMeter test problems...

So it is done! Working!
